{"format":"engram-mesh","version":"0.3","mesh_id":"mesh_01ARZ3NDEKTSV4RRFFQ69G5FAV","sources":[{"id":"source_01ARZ3NDEKTSV4RRFFQ69G5FAW","kind":"okf","identity_domain":"example.org/bundle","capabilities":["discover","read"]}],"nodes":[{"id":"node_01ARZ3NDEKTSV4RRFFQ69G5FAY","title":"A"},{"id":"node_01ARZ3NDEKTSV4RRFFQ69G5FAZ","title":"B"}],"bindings":[{"id":"binding_01ARZ3NDEKTSV4RRFFQ69G5FB0","node":"node_01ARZ3NDEKTSV4RRFFQ69G5FAY","source":"source_01ARZ3NDEKTSV4RRFFQ69G5FAW","external_id":"a","object_generation":"1","state":"active","authority":"authoritative"}],"relationships":[{"id":"relationship_01ARZ3NDEKTSV4RRFFQ69G5FB2","from":"node_01ARZ3NDEKTSV4RRFFQ69G5FAY","to":"node_01ARZ3NDEKTSV4RRFFQ69G5FAZ","type":"references"}]}
