{
  "format": "engram-mesh", "version": "0.3", "mesh_id": "mesh_01ARZ3NDEKTSV4RRFFQ69G5FAV",
  "sources": [{"id": "source_01ARZ3NDEKTSV4RRFFQ69G5FAW", "kind": "okf", "identity_domain": "example.org/knowledge", "display_name": "Knowledge bundle", "capabilities": ["discover", "read"]}, {"id": "source_01ARZ3NDEKTSV4RRFFQ69G5FAX", "kind": "github", "identity_domain": "github.com/example/repo", "capabilities": ["discover", "read", "modify"]}],
  "nodes": [{"id": "node_01ARZ3NDEKTSV4RRFFQ69G5FAY", "type": "Playbook", "title": "Release guide"}, {"id": "node_01ARZ3NDEKTSV4RRFFQ69G5FAZ", "type": "Repository", "title": "Service repository"}],
  "bindings": [{"id": "binding_01ARZ3NDEKTSV4RRFFQ69G5FB0", "node": "node_01ARZ3NDEKTSV4RRFFQ69G5FAY", "source": "source_01ARZ3NDEKTSV4RRFFQ69G5FAW", "external_id": "runbooks/release", "object_generation": "1", "state": "active", "authority": "authoritative", "freshness": {"revision": "a1b2c3", "observed_at": "2026-08-19T00:00:00Z"}}, {"id": "binding_01ARZ3NDEKTSV4RRFFQ69G5FB1", "node": "node_01ARZ3NDEKTSV4RRFFQ69G5FAZ", "source": "source_01ARZ3NDEKTSV4RRFFQ69G5FAX", "external_id": "example/service", "object_generation": "1", "state": "active", "authority": "authoritative"}],
  "relationships": [{"id": "relationship_01ARZ3NDEKTSV4RRFFQ69G5FB2", "from": "node_01ARZ3NDEKTSV4RRFFQ69G5FAY", "to": "node_01ARZ3NDEKTSV4RRFFQ69G5FAZ", "type": "references"}],
  "slices": [{"id": "slice_01ARZ3NDEKTSV4RRFFQ69G5FB3", "scope": "partial", "selection": {"mechanism": "manual", "description": "Release context"}, "sources": ["source_01ARZ3NDEKTSV4RRFFQ69G5FAW"], "nodes": ["node_01ARZ3NDEKTSV4RRFFQ69G5FAY"], "bindings": ["binding_01ARZ3NDEKTSV4RRFFQ69G5FB0"], "relationships": [], "boundary": [{"kind": "relationship", "id": "relationship_01ARZ3NDEKTSV4RRFFQ69G5FB2", "disposition": "omitted"}]}],
  "lenses": [{"id": "lens_01ARZ3NDEKTSV4RRFFQ69G5FB4", "mechanism": "org.example.tag-query", "version": "1", "expression": "tag:release"}]
}
