{"format":"engram-mesh","version":"0.3","mesh_id":"mesh_01ARZ3NDEKTSV4RRFFQ69G5FAV","sources":[{"id":"source_01ARZ3NDEKTSV4RRFFQ69G5FAW","kind":"filesystem","identity_domain":"vault-a","capabilities":["read","move"]}],"nodes":[{"id":"node_01ARZ3NDEKTSV4RRFFQ69G5FAY","title":"Moved note"}],"bindings":[{"id":"binding_01ARZ3NDEKTSV4RRFFQ69G5FB0","node":"node_01ARZ3NDEKTSV4RRFFQ69G5FAY","source":"source_01ARZ3NDEKTSV4RRFFQ69G5FAW","external_id":"old/path.md","object_generation":"1","state":"superseded","authority":"reference","successor":"binding_01ARZ3NDEKTSV4RRFFQ69G5FB1"},{"id":"binding_01ARZ3NDEKTSV4RRFFQ69G5FB1","node":"node_01ARZ3NDEKTSV4RRFFQ69G5FAY","source":"source_01ARZ3NDEKTSV4RRFFQ69G5FAW","external_id":"new/path.md","object_generation":"1","state":"active","authority":"authoritative","capabilities":["read","move"]}],"relationships":[]}
